{
  "SchemaVersion": 1,
  "ArtifactKind": "backup-receipt",
  "SourceTransactionId": "1a2b3c4d-1111-4a2b-8c3d-000000000001",
  "ReceiptId": "2b3c4d5e-2222-4b3c-9d4e-000000000002",
  "ReceiptPath": "C:\\fixture\\backups\\2b3c4d5e-2222-4b3c-9d4e-000000000002",
  "SourceOperationKind": "retirement",
  "PlanHash": "1111111111111111111111111111111111111111111111111111111111111111",
  "DocumentHash": "2222222222222222222222222222222222222222222222222222222222222222",
  "ExecutionContextHash": "3333333333333333333333333333333333333333333333333333333333333333",
  "ControlBaseHash": "4444444444444444444444444444444444444444444444444444444444444444",
  "FilesystemCapabilityHash": "5555555555555555555555555555555555555555555555555555555555555555",
  "HomeAuthorityKey": "aaaaaaaaaaaaaaaaaaaaaaaaaaaaaaaaaaaaaaaaaaaaaaaaaaaaaaaaaaaaaaaa",
  "ReceiptIntent": {
    "Id": "2b3c4d5e-2222-4b3c-9d4e-000000000002",
    "Path": "C:\\fixture\\backups\\2b3c4d5e-2222-4b3c-9d4e-000000000002"
  },
  "ManagedSnapshots": [
    {
      "Platform": "Claude",
      "RootHash": "6666666666666666666666666666666666666666666666666666666666666666",
      "Targets": [
        {
          "Name": "demo-skill",
          "Status": "COPIED",
          "LiveIdentity": "a1b2c3d4:0000000000000b01",
          "SnapshotTreeHash": "7777777777777777777777777777777777777777777777777777777777777777"
        }
      ],
      "LiveRoot": "C:\\fixture\\profile\\.claude\\skills"
    },
    {
      "Platform": "Codex",
      "RootHash": "8888888888888888888888888888888888888888888888888888888888888888",
      "Targets": [
        {
          "Name": "demo-skill",
          "Status": "COPIED",
          "LiveIdentity": "a1b2c3d4:0000000000000b02",
          "SnapshotTreeHash": "9999999999999999999999999999999999999999999999999999999999999999"
        },
        {
          "Name": "missing-skill",
          "Status": "MISSING",
          "LiveIdentity": null,
          "SnapshotTreeHash": null
        }
      ],
      "LiveRoot": "C:\\fixture\\profile\\.codex\\skills"
    },
    {
      "Platform": "Reasonix",
      "RootHash": "bbbbbbbbbbbbbbbbbbbbbbbbbbbbbbbbbbbbbbbbbbbbbbbbbbbbbbbbbbbbbbbb",
      "Targets": [],
      "LiveRoot": "C:\\fixture\\roaming\\reasonix\\skills"
    }
  ],
  "UnknownMarkers": [
    {
      "Platform": "Codex",
      "Name": "unknown-local",
      "Identity": "a1b2c3d4:0000000000000c01"
    }
  ],
  "SystemMarker": {
    "Platform": "Codex",
    "Name": ".system",
    "Present": true,
    "Identity": "a1b2c3d4:0000000000000c02"
  },
  "AuthorityStatePreimage": {
    "Status": "COPIED",
    "SourcePath": "C:\\fixture\\control\\homes\\aaaaaaaaaaaaaaaaaaaaaaaaaaaaaaaaaaaaaaaaaaaaaaaaaaaaaaaaaaaaaaaa\\current-env.json",
    "Hash": "cccccccccccccccccccccccccccccccccccccccccccccccccccccccccccccccc",
    "Length": 1234,
    "Identity": "a1b2c3d4:0000000000000c03"
  },
  "RootClaimsPreimage": {
    "Status": "COPIED",
    "SourcePath": "C:\\fixture\\control\\homes\\aaaaaaaaaaaaaaaaaaaaaaaaaaaaaaaaaaaaaaaaaaaaaaaaaaaaaaaaaaaaaaaa\\root-claims.json",
    "Hash": "dddddddddddddddddddddddddddddddddddddddddddddddddddddddddddddddd",
    "Length": 2345,
    "Identity": "a1b2c3d4:0000000000000c04"
  },
  "CreatedAtUtc": "2026-09-09T00:00:00.0000000Z",
  "ReceiptHash": "609fb62bdac2aff66a60d38e350fe16e5463ae83881351bed984b6a86c3396a9"
}
